60586,60587,Nicholas Gregory,,,paper,,borderless,,255026,255025,,,B,,,0.0,,228.0,,,,,"nonfoil,foil",Dracula's Tomb,"There was one great tomb more lordly than all of the rest; huge it was, and nobly proportioned. On it was but one word
DRACULA.",legendary,2015,,0,0,1,1,0,0,0,0,0,0,0,1,0,0,0,0,0,,English,normal,,,,,0.0,,,,fb8baec1-2076-5b48-bc15-081d77bf47e1,,,,Phyrexian Tower,208,,2021-11-29,,,,,"JMP,PLIST,SLD,UMA,USG,WC00",,"{'cardKingdom': 'https://mtgjson.com/links/5179eae41c60a4a0', 'cardKingdomFoil': 'https://mtgjson.com/links/3308b90d74afad10', 'tcgplayer': 'https://mtgjson.com/links/464b917211eedd3b'}",rare,,3097b876-ffb4-4388-beb1-d25d887593b9,d0199b3c-c677-4b57-94ec-443029818c5a,1861e642-21d5-4232-89f3-b5557f2946c1,oval,SLD,,,,Legendary,,259260,"{T}: Add {C}.
{T}, Sacrifice a creature: Add {B}{B}.",,Legendary Land,Land,df33fdfa-bd34-5864-9645-798f19f85dd8,,
69490,69491,Greg Staples,,,"arena,mtgo,paper",,borderless,,253216,252556,,82733,B,,B,3.0,,6082.0,,,,,"nonfoil,foil","Dracula, Blood Immortal",,,2015,,0,0,1,1,0,0,0,0,0,0,0,0,0,1,0,0,0,Flying,English,normal,,,,{2}{B},3.0,581923,346716,79135,f1360d0a-95c8-5baf-bbe9-a270ff094c58,,,544469,Falkenrath Forebear,334,,,"Flying
Falkenrath Forebear can't block.
Whenever Falkenrath Forebear deals combat damage to a player, create a Blood token.
{B}, Sacrifice two Blood tokens: Return Falkenrath Forebear from your graveyard to the battlefield.",Creature — Vampire,,3,"DBL,PVOW,VOW","draculaseries,boosterfun","{'cardKingdom': 'https://mtgjson.com/links/07aeb63fd7c85f2a', 'cardKingdomFoil': 'https://mtgjson.com/links/a66f4278849645ed', 'cardmarket': 'https://mtgjson.com/links/6385b35a239fffa8', 'tcgplayer': 'https://mtgjson.com/links/3453c518ba3fe09a'}",rare,,48d43ab9-772d-4f4d-8536-3ea60e8f9f82,fbcb239b-6855-4b2a-a22c-59c2a5ff6e6e,940080ce-c504-48c8-a763-326fef907217,oval,VOW,,,Vampire,,,253071,"Flying
Falkenrath Forebear can't block.
Whenever Falkenrath Forebear deals combat damage to a player, create a Blood token.
{B}, Sacrifice two Blood tokens: Return Falkenrath Forebear from your graveyard to the battlefield.",1,Creature — Vampire,Creature,ea7f0224-cd76-5d73-9c40-067aa598e8c2,"bca2c03d-5d5e-5b9d-b414-f687455726d0,ee6f8412-2871-5eef-8ce9-107dee84b1c8",
69496,69497,Johann Bodin,,,"arena,mtgo,paper",,borderless,,253165,252415,,82723,B,,B,2.0,,4642.0,2.0,"Dracula, Lord of Blood",2.0,Voldaren Bloodcaster,"nonfoil,foil","Dracula, Lord of Blood // Dracula, Lord of Bats",,sunmoondfc,2015,,0,0,1,1,0,0,0,0,0,0,0,0,0,1,0,0,0,"Flying,Transform",English,transform,,,,{1}{B},2.0,581328,346582,79141,d273eb12-91a4-52b5-a545-c47680645d38,,,544475,Voldaren Bloodcaster // Bloodbat Summoner,338,,,"Flying
Whenever Voldaren Bloodcaster or another nontoken creature you control dies, create a Blood token.
Whenever you create a Blood token, if you control five or more Blood tokens, transform Voldaren Bloodcaster.",Creature — Vampire Wizard,409a24b6-f398-586f-a09c-881b79f3b9f9,2,"DBL,PVOW,VOW","draculaseries,boosterfun","{'cardKingdom': 'https://mtgjson.com/links/7fa885a43fb6f2ae', 'cardKingdomFoil': 'https://mtgjson.com/links/1f949325e41f2e38', 'cardmarket': 'https://mtgjson.com/links/fe8b399589282bbc', 'tcgplayer': 'https://mtgjson.com/links/0ebd8b253fb52c7a'}",rare,,0954ed3d-a5d8-4330-b07c-bf3e51192e4b,3d5d971e-abd6-4161-a203-bd20e36f89a8,a720f3d3-c2d7-4e50-8cc6-600120380e9c,oval,VOW,a,,"Vampire,Wizard",,,253196,"Flying
Whenever Voldaren Bloodcaster or another nontoken creature you control dies, create a Blood token. (It's an artifact with ""{1}, {T}, Discard a card, Sacrifice this artifact: Draw a card."")
Whenever you create a Blood token, if you control five or more Blood tokens, transform Voldaren Bloodcaster.",1,Creature — Vampire Wizard,Creature,ee52dc1d-3c5b-5fba-ae84-e2017c039deb,"cb5067fe-fe6e-5253-af3e-5a032903ec24,79f546ad-9452-5880-b095-9496480a9561",
69497,69498,Johann Bodin,,,"arena,mtgo,paper",,borderless,,,,,82723,B,B,B,2.0,,4642.0,0.0,"Dracula, Lord of Bats",0.0,Bloodbat Summoner,"nonfoil,foil","Dracula, Lord of Blood // Dracula, Lord of Bats","""Do you mean to tell me that Lucy was bitten by such a bat . . . ?""",sunmoondfc,2015,,0,0,1,1,0,0,0,0,0,0,0,0,0,1,0,0,0,Flying,English,transform,,,,,2.0,581328,,79141,ed15490e-ab71-5d52-9dc6-38f455945104,,,544476,Voldaren Bloodcaster // Bloodbat Summoner,338,,,"Flying
At the beginning of combat on your turn, up to one target Blood token you control becomes a 2/2 black Bat creature with flying and haste in addition to its other types.",Creature — Vampire Wizard,ee52dc1d-3c5b-5fba-ae84-e2017c039deb,3,"DBL,PVOW,VOW","draculaseries,boosterfun",{'tcgplayer': 'https://mtgjson.com/links/2117873a6713f1df'},rare,,0954ed3d-a5d8-4330-b07c-bf3e51192e4b,9c190f1e-4004-4f01-b799-e866f1d9da2b,a720f3d3-c2d7-4e50-8cc6-600120380e9c,oval,VOW,b,,"Vampire,Wizard",,,253196,"Flying
At the beginning of combat on your turn, up to one target Blood token you control becomes a 2/2 black Bat creature with flying and haste in addition to its other types.",3,Creature — Vampire Wizard,Creature,409a24b6-f398-586f-a09c-881b79f3b9f9,"2dd36e10-21c2-5b6f-944c-3eb8e012204d,b2cd6db0-34b7-561d-9736-7b5d783c9d06",
60711,60712,Colin Boyer,,,paper,,black,,252216,252203,,,"U,W",,"U,W",4.0,,10928.0,,,,,"nonfoil,foil","Dustin, Gadget Genius",,"legendary,inverted",2015,,0,0,1,1,0,0,0,0,0,0,0,0,0,0,0,0,0,,English,normal,"{'brawl': False, 'commander': True, 'oathbreaker': False}",,,{2}{W}{U},4.0,,,,9e8e950b-bff5-5cab-914a-a4344521ca01,,,,"Hargilde, Kindly Runechanter",342,,2021-10-15,,,,2,"SLD,SLX",,"{'cardKingdom': 'https://mtgjson.com/links/b93d74279b463b01', 'cardKingdomFoil': 'https://mtgjson.com/links/adea4cc57ff6f657', 'tcgplayer': 'https://mtgjson.com/links/4e9e61b5dccc58cd'}",rare,,281f1182-8ab2-4ae6-a38c-13cdbdb1fe43,e7954b27-7595-46ad-9046-762362c6d7a6,747009e7-da07-48c7-b838-687f19b884ea,triangle,SLD,,,Human,Legendary,,251738,"{T}: Add {C}{C}. Spend this mana only to cast artifact spells or activate abilities of artifacts.
Friends forever (You can have two commanders if both have friends forever.)",3,Legendary Creature — Human,Creature,2c53909f-3730-5fef-abeb-60475028ffa5,,
60712,60713,Pauline Voss,,,paper,,black,,252217,252202,,,"B,R,U",,"B,R,U",4.0,,8422.0,,,,,"nonfoil,foil","Eleven, the Mage",,"legendary,inverted",2015,,0,0,1,1,0,0,0,0,0,0,0,0,0,0,0,0,0,,English,normal,"{'brawl': False, 'commander': True, 'oathbreaker': False}",,,{1}{U}{B}{R},4.0,,,,04c0556b-4ff4-5a5a-a692-33b9473a43bb,,,,"Cecily, Haunted Mage",343,,2021-10-15,,,,3,"SLD,SLX",,"{'cardKingdom': 'https://mtgjson.com/links/4bde2a4b2985ca79', 'cardKingdomFoil': 'https://mtgjson.com/links/9c1c0abbfcca6aee', 'tcgplayer': 'https://mtgjson.com/links/5fa11d8d2fdf52b5'}",rare,,33e1e8fc-77b4-409d-9fc4-7bc6f6ae3e26,f98f28d6-812e-43c4-8f7c-377835c8054d,a726c27d-2955-4d41-b8a6-fca654c020a2,triangle,SLD,,,"Human,Wizard",Legendary,,251739,"Your maximum hand size is eleven.
Whenever Cecily, Haunted Mage attacks, you draw a card and you lose 1 life. Then if you have eleven or more cards in your hand, you may cast an instant or sorcery spell from your hand without paying its mana cost.
Friends forever (You can have two commanders if both have friends forever.)",5,Legendary Creature — Human Wizard,Creature,35422858-fe8b-574c-8149-c0f44968fa53,,
29135,29136,Nicholas Gregory,,,"arena,mtgo,paper",,borderless,,233139,232168,,67246,"G,R,U",,"G,R,U",5.0,,5106.0,,,,,"nonfoil,foil","Ghidorah, King of the Cosmos",,legendary,2015,,0,0,1,1,0,0,0,0,0,0,0,0,0,1,0,0,0,"Flying,Mutate,Trample",English,normal,"{'brawl': False, 'commander': True, 'oathbreaker': False}",,,{2}{G}{U}{R},5.0,451038,300348,73525,0d7b6cf7-cc20-5e93-bc4b-2ff69f9d831a,,,482378,"Illuna, Apex of Wishes",379,,,"Mutate {3}{RG}{U}{U}
Flying, trample
Whenever this creature mutates, exile cards from the top of your library until you exile a nonland permanent card. Put that card onto the battlefield or into your hand.",Legendary Creature — Beast Elemental Dinosaur,,6,"DMC,IKO,PIKO,PRM","boxtopper,godzillaseries,boosterfun","{'cardKingdom': 'https://mtgjson.com/links/94028da72b3f74c9', 'cardKingdomFoil': 'https://mtgjson.com/links/f702fcbf3cfb3ac6', 'cardmarket': 'https://mtgjson.com/links/7f012cb10cb169eb', 'tcgplayer': 'https://mtgjson.com/links/4c934929a612230e'}",mythic,,bfb1fba6-8eb3-4338-9249-cec888c892dc,a1d69d81-a9cd-446e-94c3-577e5dd2ed96,08daa30f-7ce0-4a72-b539-fbb0c585fd73,oval,IKO,,,"Beast,Elemental,Dinosaur",Legendary,,212004,"Mutate {3}{R/G}{U}{U} (If you cast this spell for its mutate cost, put it over or under target non-Human creature you own. They mutate into the creature on top plus all abilities from under it.)
Flying, trample
Whenever this creature mutates, exile cards from the top of your library until you exile a nonland permanent card. Put that card onto the battlefield or into your hand.",6,Legendary Creature — Beast Elemental Dinosaur,Creature,824d322b-6117-5f32-a56a-5c67cb6a6baf,"f3f01bdc-5679-5f7d-94cc-caa5c889f620,0898a67d-e593-5028-b0e2-66f9fe5c11b4",
29140,29141,Jesper Ejsing,,,"arena,mtgo,paper",,borderless,,233142,232171,,67244,"B,U",,"B,U",6.0,,2629.0,,,,,"nonfoil,foil","Gigan, Cyberclaw Terror",,"companion,legendary",2015,,0,0,1,1,0,0,0,0,0,0,0,0,0,1,0,0,0,"Companion,Mill",English,normal,"{'brawl': False, 'commander': True, 'oathbreaker': False}",,,{4}{U/B}{U/B},6.0,451083,300428,73530,b6c0604b-fe84-5da1-bd34-fb0b271ef81a,,,482383,"Gyruda, Doom of Depths",384,,,"Companion — Your starting deck contains only cards with even converted mana costs.
When Gyruda enters the battlefield, each player puts the top four cards of their library into their graveyard. Put a creature card with an even converted mana cost from among those cards onto the battlefield under your control.",Legendary Creature — Demon Kraken,,6,"IKO,PIKO,PRM","boxtopper,godzillaseries,boosterfun","{'cardKingdom': 'https://mtgjson.com/links/fe02bd66c5f9dfe3', 'cardKingdomFoil': 'https://mtgjson.com/links/c5e63d2a09056e8c', 'cardmarket': 'https://mtgjson.com/links/a3b8ed54048a25ff', 'tcgplayer': 'https://mtgjson.com/links/5b453cdcb98fcb7d'}",rare,,206739b3-9b6a-4855-a2c3-721879bdbfb7,bc2d8c25-491d-4aae-b7c6-f9b8d8a00f08,25eaa977-ca85-4f8d-8be5-9297a3edb14f,oval,IKO,,,"Demon,Kraken",Legendary,,212253,"Companion — Your starting deck contains only cards with even mana values. (If this card is your chosen companion, you may put it into your hand from outside the game for {3} any time you could cast a sorcery.)
When Gyruda enters the battlefield, each player mills four cards. Put a creature card with an even mana value from among the milled cards onto the battlefield under your control.",6,Legendary Creature — Demon Kraken,Creature,f4d96a33-af22-5177-92a8-c79537b530d2,"6f3fc058-f695-5b01-8262-a88b95dd1d5f,c852305e-6481-59c0-b540-5372cdaee0bb",
29131,29132,Yigit Koroglu,,,"arena,mtgo,paper",,borderless,,233159,232214,,67255,R,,R,7.0,,4286.0,,,,,"nonfoil,foil","Godzilla, Doom Inevitable",,legendary,2015,,0,0,1,1,0,0,0,0,0,0,0,0,0,1,0,0,0,"Cycling,Haste,Trample",English,normal,"{'brawl': False, 'commander': True, 'oathbreaker': False}",,,{5}{R}{R},7.0,451803,300608,73521,26a08e58-ee46-52b8-b27d-ed693e7678d5,,,482374,"Yidaro, Wandering Monster",375,,,"Trample, haste
Cycling {1}{R}
When you cycle Yidaro, Wandering Monster, shuffle it into your library from your graveyard. If you've cycled a card named Yidaro, Wandering Monster four or more times this game, put it onto the battlefield from your graveyard instead.",Legendary Creature — Dinosaur Turtle,,8,"IKO,PIKO,PRM","boxtopper,godzillaseries,boosterfun","{'cardKingdom': 'https://mtgjson.com/links/ccc011e12ca80dbb', 'cardKingdomFoil': 'https://mtgjson.com/links/2836429f95e48fdd', 'cardmarket': 'https://mtgjson.com/links/dd769305165a14f0', 'tcgplayer': 'https://mtgjson.com/links/796d8617e96290da'}",rare,,8bb6b4c7-4f18-4bea-b927-916c7bb987ee,9539747c-eff1-42c8-bbc2-1ab72a90097e,6c0e22f2-f0f3-43e6-87c5-c543032112d8,oval,IKO,,,"Dinosaur,Turtle",Legendary,,212061,"Trample, haste
Cycling {1}{R}
When you cycle Yidaro, Wandering Monster, shuffle it into your library from your graveyard. If you've cycled a card named Yidaro, Wandering Monster four or more times this game, put it onto the battlefield from your graveyard instead. (Do this before you draw.)",8,Legendary Creature — Dinosaur Turtle,Creature,ada1956b-bb99-5e73-b440-e6c320ba133a,"1ed1090b-a684-5560-ae82-946f39d710b1,11a2496e-22c2-5ac8-b094-20dc58815110",
29029,29030,Antonio José Manzanedo,,,"arena,mtgo,paper",,borderless,,232699,232701,,67434,"G,R",,"G,R",5.0,,6842.0,,,,,"nonfoil,foil","Godzilla, King of the Monsters",,legendary,2015,,0,0,1,1,0,0,0,0,0,1,0,0,0,1,0,0,0,Trample,English,normal,"{'brawl': False, 'commander': True, 'oathbreaker': False}",,,{3}{R}{G},5.0,,,71341,1bff68ff-38d0-5a26-9613-38618ed9b961,,80583,482524,"Zilortha, Strength Incarnate",275,,,"Trample
Lethal damage dealt to creatures you control is determined by their power rather than their toughness.",Legendary Creature — Dinosaur,,7,IKO,"godzillaseries,buyabox","{'cardKingdom': 'https://mtgjson.com/links/57e7d7d77a50c363', 'cardKingdomFoil': 'https://mtgjson.com/links/4ceaa54fa9d7c758', 'tcgplayer': 'https://mtgjson.com/links/73c257fa5a7fc613'}",mythic,,9a0639a0-c898-4a07-975c-a02bdd53175b,8d559a97-e193-48f3-93c4-e8161ce0613a,2dba8d8d-891e-482e-8014-879f701d0619,oval,IKO,,,Dinosaur,Legendary,,212041,"Trample
Lethal damage dealt to creatures you control is determined by their power rather than their toughness.",3,Legendary Creature — Dinosaur,Creature,bf553e3b-7b79-5cf1-a40e-a0115baa6b81,30c3ae76-75b2-5fee-be86-2a847ce7c954,
29133,29134,Lius Lasahido,,,"arena,mtgo,paper",,borderless,,233145,232177,,67252,G,,G,9.0,,2266.0,,,,,"nonfoil,foil","Godzilla, Primeval Champion",,,2015,,0,0,1,1,0,0,0,0,0,0,0,0,0,1,0,0,0,"Cycling,Trample",English,normal,,,,{7}{G}{G},9.0,451108,300438,73523,ec7c426d-409b-5c98-a722-e30abdc4f96e,,,482376,Titanoth Rex,377,,,"Trample
Cycling {1}{G}
When you cycle Titanoth Rex, put a trample counter on target creature you control.",Creature — Dinosaur Beast,,11,"IKO,PRM","boxtopper,godzillaseries,boosterfun","{'cardKingdom': 'https://mtgjson.com/links/4ed449ef3b833564', 'cardKingdomFoil': 'https://mtgjson.com/links/74fc6a8ce1f209e1', 'cardmarket': 'https://mtgjson.com/links/f1d26a3860f13276', 'tcgplayer': 'https://mtgjson.com/links/3b2627287d37061d'}",uncommon,,b4817b86-d55a-4334-82ee-603f8c4b3e93,cffdb3a7-0383-469c-be38-e50dff67c4b5,8656a32b-eb95-402b-9daf-0b6d876b4b13,,IKO,,,"Dinosaur,Beast",,,212031,"Trample
Cycling {1}{G} ({1}{G}, Discard this card: Draw a card.)
When you cycle Titanoth Rex, put a trample counter on target creature you control.",11,Creature — Dinosaur Beast,Creature,65a430c8-6201-5667-8606-0bd8512e0d6e,8c9f38a6-4e08-5d56-a07c-aa39f211d0e3,
61009,61010,Riot Games,,,paper,,black,,262230,260713,,,G,,G,1.0,,1010.0,,,,,"nonfoil,foil",Gromp,"Gromp spores can be distilled into a variety of powerful chemical agents, or added to tea for a disastrous afternoon in the city.",,2015,,0,0,1,1,0,0,0,0,0,0,0,1,0,0,0,0,0,,English,normal,,,,{G},1.0,,,,dc4348c3-d313-562d-aadd-d476017d267b,,,,Spore Frog,696,,2021-11-29,,,,1,"MH1,PCY,SLD",,"{'cardKingdom': 'https://mtgjson.com/links/d7666c72b819fc4e', 'cardKingdomFoil': 'https://mtgjson.com/links/dea19b5f8968f7a3', 'tcgplayer': 'https://mtgjson.com/links/c6de3ed44eb8be8c'}",rare,,7a0d52a9-8694-46b4-aa0e-7b42b45b11db,2bb3bfea-bc95-4de1-a4fd-11706c288e85,97db6c39-e690-49b6-93a6-e51b8dfad10b,triangle,SLD,,,Frog,,,257778,Sacrifice Spore Frog: Prevent all combat damage that would be dealt this turn.,1,Creature — Frog,Creature,7b8abbab-1a9d-515d-9832-b50d5198c692,,
60996,60997,Jason Rainville,,,paper,,borderless,,264709,264710,,,R,,R,1.0,,306.0,,,,,"nonfoil,foil",Hadoken,,,2015,,0,0,1,1,0,0,0,0,0,0,0,1,0,0,0,0,0,,English,normal,,,,{R},1.0,,,,b1d6566c-3cd9-5051-9ba3-5f23a3af5c6f,,,,Lightning Bolt,675,,2022-02-18,,,,,"2ED,2X2,30A,3ED,4BB,4ED,A25,ATH,BTD,CED,CEI,CLB,E01,FBB,HBG,J21,JGP,JMP,LEA,LEB,M10,M11,MB1,ME1,MM2,P10,PD2,PF19,PLIST,PRM,PTC,SLD,STA,SUM,TD0",,"{'cardKingdom': 'https://mtgjson.com/links/247c56b5aee28174', 'cardKingdomFoil': 'https://mtgjson.com/links/6096e5619a467e3d', 'tcgplayer': 'https://mtgjson.com/links/a384a3e321b94909'}",rare,,27740ea5-79c8-420f-bc49-6d5eac58dac5,85c6f286-0e79-46ae-a576-96f28a461c0b,4457ed35-7c10-48c8-9776-456485fdf070,triangle,SLD,,,,,,272554,Lightning Bolt deals 3 damage to any target.,,Instant,Instant,28774c48-654f-5fdc-9547-42a187ff57c8,"26bb9b31-fc82-54b3-b13e-56dd1dba312a,fa340683-e523-511d-8c98-ea498d69da0c,20446d8e-c01e-5d05-93c1-488efb00087c,6787846a-9e3d-52cb-a190-24f29331c62d",
69505,69506,Alix Branwyn,,,"arena,mtgo,paper",,borderless,,253203,252527,,82734,,,,2.0,,5775.0,,,,,"nonfoil,foil",Harker's Journal,,,2015,,0,0,1,1,0,0,0,0,0,0,0,0,0,1,0,0,0,,English,normal,,,,{2},2.0,581912,346672,79150,6788e550-bf50-5edc-b186-7db814024afc,,,544484,Investigator's Journal,345,,,"Investigator's Journal enters the battlefield with a number of suspect counters on it equal to the greatest number of creatures a player controls.
{2}, {T}, Remove a suspect counter from Investigator's Journal: Draw a card.
{2}, Sacrifice Investigator's Journal: Draw a card.",Artifact — Clue,,,"DBL,PVOW,VOW","draculaseries,boosterfun","{'cardKingdom': 'https://mtgjson.com/links/01615fe42c1ec2c2', 'cardKingdomFoil': 'https://mtgjson.com/links/01982c5f68661c54', 'cardmarket': 'https://mtgjson.com/links/111e96c8560d749b', 'tcgplayer': 'https://mtgjson.com/links/090bb6a7fed8c4c3'}",rare,,a8191ff1-458f-4295-b253-c4748c933e92,30316f76-3691-47f7-91aa-78e2396e776e,22e0e822-c4aa-4ec1-b7e4-0c1c869ef71b,oval,VOW,,,Clue,,,253207,"Investigator's Journal enters the battlefield with a number of suspect counters on it equal to the greatest number of creatures a player controls.
{2}, {T}, Remove a suspect counter from Investigator's Journal: Draw a card.
{2}, Sacrifice Investigator's Journal: Draw a card.",,Artifact — Clue,Artifact,3471dadd-e2d0-51c2-af46-2ae3e51e3315,"10a4e7eb-5884-51b4-ad19-98e30d63e3ec,fe0e7e78-b0e3-5c39-83b5-d6dd93fbe87a",
60970,60971,Ravenna Tran,,,paper,,black,,258031,252337,,,B,,,0.0,,6543.0,0.0,Hawkins National Laboratory,0.0,Havengul Laboratory,"nonfoil,foil",Hawkins National Laboratory // The Upside Down,"""Today, we make history. Today, we make contact.""
—Dr. Martin Brenner","legendary,upsidedowndfc",2015,,0,0,1,1,0,0,0,0,0,0,0,0,0,0,0,0,0,"Investigate,Transform",English,transform,,,,,0.0,611222,,,35f8301c-b4e9-5d0c-8608-7703efc28c40,,,,Havengul Laboratory // Havengul Mystery,609,,2021-10-18,,,f21ea2f3-8ef4-55fc-b7fb-5d68ad005a1e,,"SLD,SLX",,"{'cardKingdom': 'https://mtgjson.com/links/773a41c211b9dc7e', 'cardKingdomFoil': 'https://mtgjson.com/links/2a483029ad4cd762', 'tcgplayer': 'https://mtgjson.com/links/fa728c3203fc9672'}",rare,,83a86763-c3fe-4cff-8b65-22cb329d112c,57eb443c-e039-4988-9f3c-e3f311667d12,e71ac446-02a4-4468-8d29-f28b21617665,triangle,SLD,a,,,Legendary,,252008,"{T}: Add {C}.
{4}, {T}: Investigate. (Create a colorless Clue artifact token with ""{2}, Sacrifice this artifact: Draw a card."")
At the beginning of your end step, if you sacrificed three or more Clues this turn, transform Havengul Laboratory.",,Legendary Land,Land,16015cde-4407-5b6a-b12b-62808c71be8b,,
60971,60972,Ravenna Tran,,,paper,,black,,,,,,B,,,0.0,,6543.0,0.0,The Upside Down,0.0,Havengul Mystery,"nonfoil,foil",Hawkins National Laboratory // The Upside Down,,"legendary,upsidedowndfc",2015,,0,0,1,1,0,0,0,0,0,0,0,0,0,0,0,0,0,Transform,English,transform,,,,,0.0,611222,,,49481217-6383-5b0f-ba0b-0dcbb8f13f3c,,,,Havengul Laboratory // Havengul Mystery,609,,2021-10-18,,,16015cde-4407-5b6a-b12b-62808c71be8b,,"SLD,SLX",,{'tcgplayer': 'https://mtgjson.com/links/fcdf597e95ce7451'},rare,,83a86763-c3fe-4cff-8b65-22cb329d112c,9fa64243-7bee-4238-9739-fd7b0bf73c72,e71ac446-02a4-4468-8d29-f28b21617665,triangle,SLD,b,,,Legendary,,252008,"When this land transforms into Havengul Mystery, return target creature card from your graveyard to the battlefield.
When the creature put onto the battlefield with Havengul Mystery leaves the battlefield, transform Havengul Mystery.
{T}, Pay 1 life: Add {B}.",,Legendary Land,Land,f21ea2f3-8ef4-55fc-b7fb-5d68ad005a1e,,
60584,60585,Nils Hamm,,,paper,,borderless,,255023,255020,,,B,,B,5.0,,654.0,,,,,"nonfoil,foil",Hunger of the Ancient One,"""Blood is too precious a thing in these days of dishonourable peace.""",,2015,,0,0,1,1,0,0,0,0,0,0,0,1,0,0,0,0,0,,English,normal,,,,{4}{B},5.0,,,,d74e1878-78b7-581a-8de6-00f402cc05ac,,,,Exquisite Blood,206,,2021-11-29,,,,,"AVR,JMP,PLIST,SLD",,"{'cardKingdom': 'https://mtgjson.com/links/90fbf2cd6dcc0fca', 'cardKingdomFoil': 'https://mtgjson.com/links/ea66b574f7777cdb', 'tcgplayer': 'https://mtgjson.com/links/856c884e283118de'}",rare,,a83dad59-27a4-4dbb-bec8-f0683d6e2a67,0cd04adf-4fda-46e2-a580-05f0e036462f,8f933fae-6c0c-42d7-a817-14760d8285cd,oval,SLD,,,,,,259261,"Whenever an opponent loses life, you gain that much life.",,Enchantment,Enchantment,3cf62271-58d7-554d-a94b-31ff0c580799,,
69487,69488,Slawomir Maniak,,,"arena,mtgo,paper",,borderless,,253265,253145,,82750,U,,U,2.0,,6939.0,2.0,Jonathan Harker,2.0,"Jacob Hauken, Inspector","nonfoil,foil",Jonathan Harker // Harker's Obsessive Inquiry,,"legendary,sunmoondfc",2015,,0,0,1,1,0,0,0,0,0,0,0,0,0,1,0,0,0,Transform,English,transform,"{'brawl': True, 'commander': True, 'oathbreaker': False}",,,{1}{U},2.0,583597,346986,79132,8e1165a6-56ec-55b4-baee-043fb5f1bade,,,544466,"Jacob Hauken, Inspector // Hauken's Insight",332,,,"{T}: Draw a card, then exile a card from your hand face down. You may look at that card for as long as it remains exiled. You may pay {4}{U}{U}. If you do, transform Jacob Hauken, Inspector.",Legendary Creature — Human Advisor,e6b11575-ba94-552a-a6ee-051294080edd,0,"DBL,PVOW,VOW","draculaseries,boosterfun","{'cardKingdom': 'https://mtgjson.com/links/54ec5a93f04cbaf1', 'cardKingdomFoil': 'https://mtgjson.com/links/3350e3f0710e06cd', 'cardmarket': 'https://mtgjson.com/links/d6cc6fde0a77b3a7', 'tcgplayer': 'https://mtgjson.com/links/00db5bc759f7ce0c'}",mythic,,c0f0004e-ee4c-4372-be5d-a5102f45210e,6021cec7-89d1-462e-83e2-a1b2e40f1abf,16d2a56a-7181-4ef3-866b-10dd8615d9e9,oval,VOW,a,,"Human,Advisor",Legendary,,253751,"{T}: Draw a card, then exile a card from your hand face down. You may look at that card for as long as it remains exiled. You may pay {4}{U}{U}. If you do, transform Jacob Hauken, Inspector.",2,Legendary Creature — Human Advisor,Creature,624bdbbd-f73e-5e13-ae98-a7d1064ecb13,"34e30c28-282b-5510-bf00-a2dbc571e5d2,98ce28b2-0189-59cd-bb09-3ce45c32b78f",
69488,69489,Slawomir Maniak,,,"arena,mtgo,paper",,borderless,,,,,82750,U,U,U,2.0,,6939.0,0.0,Harker's Obsessive Inquiry,0.0,Hauken's Insight,"nonfoil,foil",Jonathan Harker // Harker's Obsessive Inquiry,,"legendary,sunmoondfc",2015,,0,0,1,1,0,0,0,0,0,0,0,0,0,1,0,0,0,,English,transform,,,,,2.0,583597,,79132,e55ebd1f-543b-58d5-b9c1-498232aad9bc,,,544467,"Jacob Hauken, Inspector // Hauken's Insight",332,,,"At the beginning of your upkeep, exile the top card of your library face down. You may look at that card for as long as it remains exiled.
Once during each of your turns, you may play a land or cast a spell from among the cards exiled with this permanent without paying its mana cost.",Legendary Enchantment,624bdbbd-f73e-5e13-ae98-a7d1064ecb13,,"DBL,PVOW,VOW","draculaseries,boosterfun",{'tcgplayer': 'https://mtgjson.com/links/f7691f5e80470dea'},mythic,,c0f0004e-ee4c-4372-be5d-a5102f45210e,ed3e3776-d661-4f7b-b705-ec588d52cedd,16d2a56a-7181-4ef3-866b-10dd8615d9e9,oval,VOW,b,,,Legendary,,253751,"At the beginning of your upkeep, exile the top card of your library face down. You may look at that card for as long as it remains exiled.
Once during each of your turns, you may play a land or cast a spell from among the cards exiled with this permanent without paying its mana cost.",,Legendary Enchantment,Enchantment,e6b11575-ba94-552a-a6ee-051294080edd,"5133fd60-dd96-5e8e-a31b-f1222e1e499b,83638ea8-ad03-52a9-95ec-22222ad372d7",
29125,29126,Slawomir Maniak,,,"arena,mtgo,paper",,borderless,,233157,232212,,67245,W,,W,4.0,,7294.0,,,,,"nonfoil,foil","King Caesar, Ancient Guardian",,,2015,,0,0,1,1,0,0,0,0,0,0,0,0,0,1,0,0,0,Mutate,English,normal,,,,{3}{W},4.0,451878,300343,73516,c237edfe-a613-5193-964c-d22026819007,,,482370,Huntmaster Liger,370,,,"Mutate {2}{W}
Whenever this creature mutates, other creatures you control get +X/+X until end of turn, where X is the number of times this creature has mutated.",Creature — Cat,,3,"IKO,PRM","boxtopper,godzillaseries,boosterfun","{'cardKingdom': 'https://mtgjson.com/links/edfb0239a5b10be8', 'cardKingdomFoil': 'https://mtgjson.com/links/8793be1408c5ae86', 'cardmarket': 'https://mtgjson.com/links/ea7226b76917cb1b', 'tcgplayer': 'https://mtgjson.com/links/517a5ab7b97a5b88'}",uncommon,,c5f741e3-82d8-4842-8054-25e20a10dddd,de82e6cd-1ef8-4995-81e3-0d7a52c6ff7d,38f5e6bf-18a3-4ff3-9726-a25a9715a2d9,,IKO,,,Cat,,,212085,"Mutate {2}{W} (If you cast this spell for its mutate cost, put it over or under target non-Human creature you own. They mutate into the creature on top plus all abilities from under it.)
Whenever this creature mutates, other creatures you control get +X/+X until end of turn, where X is the number of times this creature has mutated.",4,Creature — Cat,Creature,9648c4a5-4e32-53d3-8332-95e8cdf2d69b,"585f1a62-cd0b-5d30-8fd5-3e74f95ea1ce,be11fd9c-0c32-5df5-a169-fee93da35ea7",
