29137,29138,YW Tang,,,"arena,mtgo,paper",,borderless,,233140,232169,,67297,"B,R,W",,"B,R,W",4.0,,7008.0,,,,,"nonfoil,foil","King Caesar, Awoken Titan",,legendary,2015,,0,0,1,1,0,0,0,0,0,0,0,0,0,1,0,0,0,"Double strike,Mutate",English,normal,"{'brawl': False, 'commander': True, 'oathbreaker': False}",,,{1}{R}{W}{B},4.0,451123,300443,73527,1b2f473b-9d2b-53a3-8e9a-23aaca3aa3bf,,,482380,"Snapdax, Apex of the Hunt",381,,,"Mutate {2}{BR}{W}{W}
Double strike
Whenever this creature mutates, it deals 4 damage to target creature or planeswalker an opponent controls and you gain 4 life.",Legendary Creature — Dinosaur Cat Nightmare,,3,"IKO,PIKO,PL22,PRM","boxtopper,godzillaseries,boosterfun","{'cardKingdom': 'https://mtgjson.com/links/59822ed42bc86a15', 'cardKingdomFoil': 'https://mtgjson.com/links/7717bd3f2fbd2964', 'cardmarket': 'https://mtgjson.com/links/798f22a1c95f4b5e', 'tcgplayer': 'https://mtgjson.com/links/a8128954a62ffa1a'}",mythic,,673d14b1-e93a-4594-b2c9-792696adb991,bc51c5a4-3e74-4d6e-9ad9-06358ced7a7f,b2b78623-5a10-4ef7-b983-3d82478269c3,oval,IKO,,,"Dinosaur,Cat,Nightmare",Legendary,,212027,"Mutate {2}{B/R}{W}{W} (If you cast this spell for its mutate cost, put it over or under target non-Human creature you own. They mutate into the creature on top plus all abilities from under it.)
Double strike
Whenever this creature mutates, it deals 4 damage to target creature or planeswalker an opponent controls and you gain 4 life.",5,Legendary Creature — Dinosaur Cat Nightmare,Creature,277249ba-20b2-5f24-8439-828c86f81386,"a7c56c17-1fe6-5520-bf32-10c4573ad68d,c0f52b87-d699-5af0-9baf-54bdc823a027",
60713,60714,Greg Staples,,,paper,,black,,252214,252205,,,"R,U",,"R,U",2.0,,8662.0,,,,,"nonfoil,foil","Lucas, the Sharpshooter",,legendary,2015,,0,0,1,1,0,0,0,0,0,0,0,0,0,0,0,0,0,Goad,English,normal,"{'brawl': False, 'commander': True, 'oathbreaker': False}",,,{U}{R},2.0,,,,046f2091-0ddb-5b36-9372-2d989b2773ba,,,,"Bjorna, Nightfall Alchemist",344,,2021-10-15,,,,1,"SLD,SLX",,"{'cardKingdom': 'https://mtgjson.com/links/fef70f9cd4c650d0', 'cardKingdomFoil': 'https://mtgjson.com/links/9c8898c5f666b2c5', 'tcgplayer': 'https://mtgjson.com/links/d9b4b0b72f4199cd'}",rare,,3b09edfe-5bef-430e-853d-a6b4b612805a,fa125be8-b904-4752-8d7d-8ef4c3f645f5,c880fbdc-bdd9-4f80-81d4-e3e1124f76ca,triangle,SLD,,,Human,Legendary,,251742,"{T}, Sacrifice an artifact: Bjorna, Nightfall Alchemist deals 1 damage to target creature. Goad that creature. (Until your next turn, that creature attacks each combat if able and attacks a player other than you if able.)
Friends forever (You can have two commanders if both have friends forever.)",3,Legendary Creature — Human,Creature,aef74d80-a1d8-5e80-97ca-65be6322c3f2,,
69493,69494,Igor Kieryluk,,,"arena,mtgo,paper",,borderless,,253202,252526,,82735,B,,B,4.0,,13220.0,4.0,Lucy Westenra,4.0,Innocent Traveler,"nonfoil,foil","Lucy Westenra // Lucy, Arisen Vampire","I looked at her throat just now as she lay asleep, and the tiny wounds seem not to have healed.",sunmoondfc,2015,,0,0,1,1,0,0,0,0,0,0,0,0,0,1,0,0,0,Transform,English,transform,,,,{2}{B}{B},4.0,581919,346670,79138,6645d342-ec36-59ca-b3eb-37cd3c4935e7,,,544472,Innocent Traveler // Malicious Invader,336,,,"At the beginning of your upkeep, any opponent may sacrifice a creature. If no one does, transform Innocent Traveler.",Creature — Human,35444858-85c9-5242-b62a-aa57f8501e99,1,"DBL,VOW","draculaseries,boosterfun","{'cardKingdom': 'https://mtgjson.com/links/1d5eede02f55221b', 'cardKingdomFoil': 'https://mtgjson.com/links/79961374cb797513', 'cardmarket': 'https://mtgjson.com/links/eac582726b4ce4f5', 'tcgplayer': 'https://mtgjson.com/links/bb550956a5054bc2'}",uncommon,,7a043975-59b4-490c-bf33-c08bd7b40bd3,efc3cfa6-88cd-41fb-a7c9-97b75b1be582,7950a7ff-7c2e-40fe-b64a-324f4fbcf528,,VOW,a,,Human,,,253194,"At the beginning of your upkeep, any opponent may sacrifice a creature. If no one does, transform Innocent Traveler.",3,Creature — Human,Creature,8e6cbd54-3006-5363-bf36-c5e63420d5e0,"604145b4-defd-5570-acd1-0c61a8c839a2,97651114-3e16-5eea-ad20-5161f20eaedf",
69494,69495,Igor Kieryluk,,,"arena,mtgo,paper",,borderless,,,,,82735,B,B,B,4.0,,13220.0,0.0,"Lucy, Arisen Vampire",0.0,Malicious Invader,"nonfoil,foil","Lucy Westenra // Lucy, Arisen Vampire",Van Helsing raised his lantern and drew the slide; by the concentrated light that fell on Lucy's face we could see that the lips were crimson with fresh blood.,sunmoondfc,2015,,0,0,1,1,0,0,0,0,0,0,0,0,0,1,0,0,0,Flying,English,transform,,,,,4.0,581919,,79138,94ebb1d6-bc24-582e-ab62-23fce862f194,,,544473,Innocent Traveler // Malicious Invader,336,,,"Flying
Malicious Invader gets +2/+0 as long as an opponent controls a Human.",Creature — Vampire,8e6cbd54-3006-5363-bf36-c5e63420d5e0,3,"DBL,VOW","draculaseries,boosterfun",{'tcgplayer': 'https://mtgjson.com/links/54ed7752d3444a9e'},uncommon,,7a043975-59b4-490c-bf33-c08bd7b40bd3,cbd4e071-ec86-4dbf-9864-d118af4f7d6f,7950a7ff-7c2e-40fe-b64a-324f4fbcf528,,VOW,b,,Vampire,,,253194,"Flying
Malicious Invader gets +2/+0 as long as an opponent controls a Human.",3,Creature — Vampire,Creature,35444858-85c9-5242-b62a-aa57f8501e99,"6f1a9d11-690a-5328-9115-d14a8006e42f,80dbd4ff-833c-547b-8c0a-21019a750923",
60714,60715,Greg Staples,,,paper,,black,,252213,252206,,,"G,R",,"G,R",3.0,,9961.0,,,,,"nonfoil,foil","Max, the Daredevil",,legendary,2015,,0,0,1,1,0,0,0,0,0,0,0,0,0,0,0,0,0,"Haste,Investigate",English,normal,"{'brawl': False, 'commander': True, 'oathbreaker': False}",,,{1}{R}{G},3.0,,,,24127e95-59bc-5dba-88f7-8eedfe992334,,,,"Elmar, Ulvenwald Informant",345,,2021-10-15,,,,3,"SLD,SLX",,"{'cardKingdom': 'https://mtgjson.com/links/b4d60b686bac05b9', 'cardKingdomFoil': 'https://mtgjson.com/links/7c5584b5a1ae4db0', 'tcgplayer': 'https://mtgjson.com/links/d0d9631f1f5048c5'}",rare,,abb04ab1-2a74-432f-b3d3-d4f5b2534066,4bd1123c-2de6-4551-8d43-5849c0d171dd,5a35201d-e9b1-433a-bb70-3280ceedbcd6,triangle,SLD,,,Human,Legendary,,251743,"Haste
Whenever you cast your second spell each turn, untap target creature, then investigate. (Create a colorless Clue artifact token with ""{2}, Sacrifice this artifact: Draw a card."")
Friends forever (You can have two commanders if both have friends forever.)",2,Legendary Creature — Human,Creature,a72058aa-a7f3-56db-9397-41f0a8c0742a,,
49617,49618,Nicholas Gregory,,,paper,,borderless,,233801,,,69881,,,,0.0,,1470.0,,,,,foil,"Mechagodzilla, Battle Fortress",,,2015,,0,0,1,0,0,0,0,0,0,1,0,1,0,1,0,0,0,,English,normal,,,,{X}{X},0.0,464734,,,136077b9-1742-56a3-8d98-3b38cb7a3e94,,,,Hangarback Walker,2,,,,,,0,"EA1,MPS,ORI,PLG20",godzillaseries,"{'cardKingdomFoil': 'https://mtgjson.com/links/e56ae4b3355ce227', 'tcgplayer': 'https://mtgjson.com/links/8c43ff30e0ac0e56'}",rare,,773916fd-060e-4abc-a060-e18768807571,25ef9467-544c-4fd5-95e0-621bef7eeb97,dde55256-5259-44e7-a267-fca45a7f0d04,oval,PLG20,,,Construct,,,215335,"Hangarback Walker enters the battlefield with X +1/+1 counters on it.
When Hangarback Walker dies, create a 1/1 colorless Thopter artifact creature token with flying for each +1/+1 counter on Hangarback Walker.
{1}, {T}: Put a +1/+1 counter on Hangarback Walker.",0,Artifact Creature — Construct,"Artifact,Creature",eaf748e5-ed61-504f-8799-bd52eb3ea9cd,,
29143,29144,Kotakan,,,"arena,mtgo,paper",,borderless,,233169,232248,,67318,,,,3.0,,3943.0,,,,,"nonfoil,foil","Mechagodzilla, the Weapon",,,2015,,0,0,1,1,0,0,0,0,0,0,0,0,0,1,0,0,0,,Japanese,normal,,,,{3},3.0,451863,300628,73651,66a3da2f-9618-56a4-8815-99e08e101e61,,,,Crystalline Giant,387,,,,,,3,"IKO,NCC,PIKO,PRM","godzillaseries,boosterfun","{'cardKingdom': 'https://mtgjson.com/links/2feda13abd750197', 'cardKingdomFoil': 'https://mtgjson.com/links/c8b065112f6c96e7', 'cardmarket': 'https://mtgjson.com/links/4b28e69f876e38e3', 'tcgplayer': 'https://mtgjson.com/links/8ee0a6868ad3f305'}",rare,,b0c2de2f-bb56-4713-861a-34523b331e26,4548a608-b620-4440-8c93-7de467539ac2,49a46cfa-f2e9-4718-a6cb-47dbb0792b56,oval,IKO,,,Giant,,,212070,"At the beginning of combat on your turn, choose a kind of counter at random that Crystalline Giant doesn't have on it from among flying, first strike, deathtouch, hexproof, lifelink, menace, reach, trample, vigilance, and +1/+1. Put a counter of that kind on Crystalline Giant.",3,Artifact Creature — Giant,"Artifact,Creature",f192bfef-50ef-535f-818e-b8a57f93a498,"f81c079e-64da-596c-9777-fdd7c06c3010,3ba9d8e5-055d-5fc5-b1ec-6d2a5637819e",
60715,60716,Colin Boyer,,,paper,,black,,252218,252204,,,"G,W",,"G,W",3.0,,10846.0,,,,,"nonfoil,foil","Mike, the Dungeon Master","""A friend is someone you'd do anything for.""","legendary,inverted",2015,,0,0,1,1,0,0,0,0,0,0,0,0,0,0,0,0,0,,English,normal,"{'brawl': False, 'commander': True, 'oathbreaker': False}",,,{1}{G}{W},3.0,,,,cd7c922d-8bfa-52a6-b9c3-45f28ed43961,,,,"Othelm, Sigardian Outcast",346,,2021-10-15,,,,2,"SLD,SLX",,"{'cardKingdom': 'https://mtgjson.com/links/7cca4640796f91d8', 'cardKingdomFoil': 'https://mtgjson.com/links/9a02deba385ee876', 'tcgplayer': 'https://mtgjson.com/links/c1cc74de7a9a96e0'}",rare,,142edc65-232b-492e-805a-6905f13e9e6d,dc8afa63-2839-45d7-8e35-3ba18ae72e19,4ee401bf-dc86-41a9-84f9-57aa0a314d08,triangle,SLD,,,Human,Legendary,,251745,"{2}, {T}: Choose target creature card in your graveyard that was put there from the battlefield this turn. Return it to the battlefield tapped.
Friends forever (You can have two commanders if both have friends forever.)",2,Legendary Creature — Human,Creature,08d9e716-2384-5fb9-8122-0d42ad869bd8,,
69486,69487,Magali Villeneuve,,,"arena,mtgo,paper",,borderless,,253163,252412,,82728,W,,W,2.0,,1007.0,,,,,"nonfoil,foil",Mina Harker,"""Our dear Madam Mina is once more our teacher. Her eyes have been where we were blinded. Now we are on the track once again, and this time we may succeed.""",legendary,2015,,0,0,1,1,0,0,0,0,0,0,0,1,0,1,0,0,0,First strike,English,normal,"{'brawl': True, 'commander': True, 'oathbreaker': False}",,,{1}{W},2.0,581361,204745,79131,4296cc90-ea68-55bb-b9f5-c350e7331ec2,,,544465,"Thalia, Guardian of Thraben",331,,,"First strike
Noncreature spells cost {1} more to cast.",Legendary Creature — Human Soldier,,2,"A25,DBL,DKA,HA2,PRM,PVOW,SLD,VOW,WMC","draculaseries,boosterfun","{'cardKingdom': 'https://mtgjson.com/links/c7fc5326ee5a4598', 'cardKingdomFoil': 'https://mtgjson.com/links/9ededd152025eb95', 'cardmarket': 'https://mtgjson.com/links/9ba29cc6f67f2473', 'tcgplayer': 'https://mtgjson.com/links/71bc09fa35f4ad74'}",rare,,1830002a-b512-4e51-b3fa-0137d2b4c749,4abd3107-8695-4bbc-9c0b-10beeab1fdae,9b7f1d05-707c-4ed3-9f0e-8ced1232c2ee,oval,VOW,,,"Human,Soldier",Legendary,,253202,"First strike
Noncreature spells cost {1} more to cast.",1,Legendary Creature — Human Soldier,Creature,5d36fe9d-6ce1-5d7c-8f15-c0d3968ee4cf,"f9925a8a-584e-511d-b4bf-393028652722,28a78ede-a937-57c9-98be-e604b6686f8c",
60709,60710,Isis,,,paper,,black,,252211,252208,,,B,,B,7.0,,4113.0,,,,,"nonfoil,foil","Mind Flayer, the Shadow",,legendary,2015,,0,0,1,1,0,0,0,0,0,0,0,0,0,0,0,0,0,,English,normal,"{'brawl': False, 'commander': True, 'oathbreaker': False}",,,{4}{B}{B}{B},7.0,,,,9989f66f-9e95-5afc-b13d-2dfa634db86a,,,,"Arvinox, the Mind Flail",340,,2021-10-15,,,,9,"SLD,SLX",,"{'cardKingdom': 'https://mtgjson.com/links/e51137d2d8db1683', 'cardKingdomFoil': 'https://mtgjson.com/links/58f462b87d6a0861', 'tcgplayer': 'https://mtgjson.com/links/fbb99ff69ac68584'}",mythic,,0fbaa2f0-9ad0-4ce2-8ce6-359d01bd524c,078760cf-7ea0-4ef6-85b9-139c79c33480,9abecd23-a2d9-43c7-8d01-f8afdc53026e,triangle,SLD,,,Horror,Legendary,,251735,"Arvinox, the Mind Flail isn't a creature unless you control three or more permanents you don't own.
At the beginning of your end step, exile the bottom card of each opponent's library face down. For as long as those cards remain exiled, you may look at them, you may cast permanent spells from among them, and you may spend mana as though it were mana of any color to cast those spells.",9,Legendary Enchantment Creature — Horror,"Enchantment,Creature",d465de12-cc8b-58a8-aa5f-3b9d2b13adca,,
29141,29142,ヨロイコウジ,,,"arena,mtgo,paper",,borderless,,233167,232246,,67317,,,,1.0,,6478.0,,,,,"nonfoil,foil",Mothra's Great Cocoon,,,2015,,0,0,1,1,0,0,0,0,0,0,0,0,0,1,0,0,0,,Japanese,normal,,,,{1},1.0,451848,300623,73649,f21b5786-bc97-5276-a8ad-d0c5c8765bb2,,,,Mysterious Egg,385,,,,,,0,"IKO,PRM","godzillaseries,boosterfun","{'cardKingdom': 'https://mtgjson.com/links/844d8287e88ce078', 'cardKingdomFoil': 'https://mtgjson.com/links/1b3e4c9ce5d5145d', 'cardmarket': 'https://mtgjson.com/links/2d95ea15a80a3328', 'tcgplayer': 'https://mtgjson.com/links/2abd1b1a7ffa9c4d'}",common,,f333b41d-e42c-4b12-be08-742eefb4e401,c1c1af68-408a-4786-ac39-d23f613d5b23,d3b62851-6013-49e5-8808-fa61b1bdfe98,,IKO,,,Egg,,,212065,"Whenever this creature mutates, put a +1/+1 counter on it.",2,Creature — Egg,Creature,5df3565b-ab85-5cc7-83c4-9cd3bb5674da,d71d5711-8598-5e61-96a9-72e0c53a9b6a,
29126,29127,Nick Southam,,,"arena,mtgo,paper",,borderless,,233137,232166,,67247,W,,W,4.0,,1343.0,,,,,"nonfoil,foil","Mothra, Supersonic Queen",,,2015,,0,0,1,1,0,0,0,0,0,0,0,0,0,1,0,0,0,Flying,English,normal,,,,{2}{W}{W},4.0,451033,300413,73517,ddf2f86e-0319-51ac-bd6e-07f04f8446d3,,,482371,Luminous Broodmoth,371,,,"Flying
Whenever a creature you control without flying dies, return it to the battlefield under its owner's control with a flying counter on it.",Creature — Insect,,3,"IKO,PIKO,PRM","boxtopper,godzillaseries,boosterfun","{'cardKingdom': 'https://mtgjson.com/links/f37df09a3935a511', 'cardKingdomFoil': 'https://mtgjson.com/links/9e3010da0f117284', 'cardmarket': 'https://mtgjson.com/links/1eb051097174eb94', 'tcgplayer': 'https://mtgjson.com/links/3b8061a2906e93d2'}",mythic,,4d393cc4-0e6b-44fe-a74a-822c52678ec9,0b0c7802-df60-4870-9a0e-024506f38afc,28c7c816-07e7-42fb-923c-bf149ba28b38,oval,IKO,,,Insect,,,212007,"Flying
Whenever a creature you control without flying dies, return it to the battlefield under its owner's control with a flying counter on it.",4,Creature — Insect,Creature,60a33c1a-8430-5be7-802f-e2ab5dd563f8,"39ebc226-262a-58fa-a44a-8db82796b6ef,91cff9f4-41ec-5359-8723-dd2e6ba6efc4",
69498,69499,Dave Kendall,,,"arena,mtgo,paper",,borderless,,253190,252474,,82732,R,,R,3.0,,6899.0,,,,,"nonfoil,foil",Mysterious Blood Illness,"She was ghastly, chalkily pale; the red seemed to have gone even from her lips and gums, and the bones of her face stood out prominently; her breathing was painful to see or hear.",,2015,,0,0,1,1,0,0,0,0,0,0,0,0,0,1,0,0,0,,English,normal,,,,{2}{R},3.0,581393,346618,79143,0c22efbf-ca6d-513a-bc60-1c7ec0fdb827,,,544477,Vampires' Vengeance,339,,,Vampires' Vengeance deals 2 damage to each non-Vampire creature. Create a Blood token.,Instant,,,"DBL,VOW","draculaseries,boosterfun","{'cardKingdom': 'https://mtgjson.com/links/5a7f313cddaf27b6', 'cardKingdomFoil': 'https://mtgjson.com/links/644dcb812fe4db31', 'cardmarket': 'https://mtgjson.com/links/d5d6c01716a7f624', 'tcgplayer': 'https://mtgjson.com/links/5c22841cc1382899'}",uncommon,,9f4ba693-0323-415d-ad91-c083fbbab7f7,0fbfd36b-d86b-444a-9ee0-c610f4b35f9b,3a82e724-28f6-430f-a474-ab4276197963,,VOW,,,,,,253016,"Vampires' Vengeance deals 2 damage to each non-Vampire creature. Create a Blood token. (It's an artifact with ""{1}, {T}, Discard a card, Sacrifice this artifact: Draw a card."")",,Instant,Instant,572b89e6-31e5-516b-ad8a-3a43416daa1a,d2a50c74-2e25-5dd4-a046-ac3cf959d6ca,
60585,60586,Tomas Duchek,,,paper,,borderless,,255024,255021,,,B,,B,2.0,,288.0,,,,,"nonfoil,foil",Nightfeeder's Visitation,"The air seems full of specks, floating and circling in the draught from the window, and the lights burn blue and dim. What am I to do? God shield me from harm this night!",,2015,,0,0,1,1,0,0,0,0,0,0,0,1,0,0,0,0,0,,English,normal,,,,{1}{B},2.0,,,,92bf4edf-46f6-586a-b551-0fb408283c18,,,,Night's Whisper,207,,2021-11-29,,,,,"5DN,DDM,DMC,EMA,MB1,SLD,VOC",,"{'cardKingdom': 'https://mtgjson.com/links/38553199dd3ace89', 'cardKingdomFoil': 'https://mtgjson.com/links/c4bc22ea8c7cc40f', 'tcgplayer': 'https://mtgjson.com/links/ce3e5ca83bea7ecf'}",rare,,f415a76e-6b35-442e-a2e1-9e368f550566,3ea14781-5eb8-49e8-b254-bc53ec6ec966,7ffae8f8-3006-4969-a339-6d30678f87ea,oval,SLD,,,,,,259259,You draw two cards and you lose 2 life.,,Sorcery,Sorcery,2fcf8f72-6010-57ab-a620-21b358e34dc6,,
47546,47547,Chase Stone,,,paper,,borderless,,,,,,"B,U,W",,"B,U,W",4.0,,2160.0,,,,,foil,Post the Enchanter,"""Now they always say 'Congratulations'""",legendary,2015,,0,0,1,0,0,0,0,0,0,0,0,1,0,1,0,0,0,Flying,English,normal,"{'brawl': False, 'commander': True, 'oathbreaker': False}",,,{1}{W}{U}{B},4.0,,,,7aec3457-9e5e-5fd1-93bd-bfbe768eb232,,,,Zur the Enchanter,8,,2022-08-16,,,,1,"2X2,CMR,CSP,J16,MM3,OCM1,PCEL,PRM",event,,rare,,050e8f17-7b51-40a4-b76c-2f3b1eb4b389,88c8ba4b-7b08-4c18-91e9-68b8cd011716,d7950018-d744-48a8-81aa-0d8384703f48,oval,PCEL,,,"Human,Wizard",Legendary,,,"Flying
Whenever Zur the Enchanter attacks, you may search your library for an enchantment card with mana value 3 or less, put it onto the battlefield, then shuffle.",4,Legendary Creature — Human Wizard,Creature,e857deed-ba35-53e7-9169-e57a5bbb22d6,,
69499,69500,Tomasz Jedruszek,,,"arena,mtgo,paper",,borderless,,253241,252649,,82742,G,,G,2.0,,7547.0,,,,,"nonfoil,foil",Quincey Harker,We want no proofs; we ask none to believe us! This boy will some day know what a brave and gallant woman his mother is.,,2015,,0,0,1,1,0,0,0,0,0,0,0,0,0,1,0,0,0,,English,normal,,,,{1}{G},2.0,582480,346790,79144,d78fd461-64aa-58e5-99d7-33ac0dfb79f4,,,544478,Reclusive Taxidermist,340,,,"Reclusive Taxidermist gets +3/+2 as long as there are four or more creature cards in your graveyard.
{T}: Add one mana of any color.",Creature — Human Druid,,1,"DBL,VOW","draculaseries,boosterfun","{'cardKingdom': 'https://mtgjson.com/links/ea8b0824fb18fb32', 'cardKingdomFoil': 'https://mtgjson.com/links/216023e9a895b359', 'cardmarket': 'https://mtgjson.com/links/3f92fbbce609cb14', 'tcgplayer': 'https://mtgjson.com/links/f87ad4dbb29e08ff'}",uncommon,,626eacad-6ea5-410a-9a3f-af97b5e52ff0,40b56f2e-0c66-4d7a-af67-537399f2546f,7a0168c5-e258-4c50-96aa-95deb2198e6f,,VOW,,,"Human,Druid",,,253496,"Reclusive Taxidermist gets +3/+2 as long as there are four or more creature cards in your graveyard.
{T}: Add one mana of any color.",2,Creature — Human Druid,Creature,a0c430bc-2fc8-56d3-b0d5-68bed8692cef,dfe75531-ab21-5b00-9723-b52ff7cbfc1a,
69502,69503,Dave Kendall,,,"arena,mtgo,paper",,borderless,,253247,252680,,82747,"R,U",,"R,U",3.0,,8160.0,,,,,"nonfoil,foil","Renfield, Delusional Minion","""The blood is the life! The blood is the life!""",legendary,2015,,0,0,1,1,0,0,0,0,0,0,0,0,0,1,0,0,0,,English,normal,"{'brawl': True, 'commander': True, 'oathbreaker': False}",,,{1}{U}{R},3.0,583238,346800,79147,4e35d6b2-b42e-524b-85ea-79f700610d5f,,,544481,"Eruth, Tormented Prophet",342,,,"If you would draw a card, exile the top two cards of your library instead. You may play those cards this turn.",Legendary Creature — Human Wizard,,2,"DBL,PVOW,VOW","draculaseries,boosterfun","{'cardKingdom': 'https://mtgjson.com/links/20e029f19220020e', 'cardKingdomFoil': 'https://mtgjson.com/links/de824a053505ea84', 'cardmarket': 'https://mtgjson.com/links/4396ef2ac6f91fed', 'tcgplayer': 'https://mtgjson.com/links/ee3ad6a8f0381f21'}",rare,,5ecbb622-f33b-4192-9b42-8872b35cc409,40c43c42-b4b4-46f5-a76f-483647747c4b,a0380b63-58ef-4545-beec-6ad307bbc21b,oval,VOW,,,"Human,Wizard",Legendary,,253667,"If you would draw a card, exile the top two cards of your library instead. You may play those cards this turn.",4,Legendary Creature — Human Wizard,Creature,17c01956-5f85-550e-ade9-e5400b63133d,"5ccc35ed-ca34-5ef2-8c2c-ccbb167701a6,e980d553-1710-5482-a6e3-409ed546de24",
29139,29140,Johann Bodin,,,"arena,mtgo,paper",,borderless,,233141,232170,,67396,"R,U,W",,"R,U,W",3.0,,6062.0,,,,,"nonfoil,foil","Rodan, Titan of Winged Fury",,legendary,2015,,0,0,1,1,0,0,0,0,0,0,0,0,0,1,0,0,0,"First strike,Flying,Mutate",English,normal,"{'brawl': False, 'commander': True, 'oathbreaker': False}",,,{U}{R}{W},3.0,451058,300423,73529,8cf6a50e-26fb-5d81-acfd-7dbbe7578ae5,,,482382,"Vadrok, Apex of Thunder",383,,,"Mutate {1}{WU}{R}{R}
Flying, first strike
Whenever this creature mutates, you may cast target noncreature card with converted mana cost 3 or less from your graveyard without paying its mana cost.",Legendary Creature — Elemental Dinosaur Cat,,3,"IKO,PIKO,PRM","boxtopper,godzillaseries,boosterfun","{'cardKingdom': 'https://mtgjson.com/links/5c5db2ab84bd85fb', 'cardKingdomFoil': 'https://mtgjson.com/links/34b66aca392721e1', 'cardmarket': 'https://mtgjson.com/links/52d11eed9a9eabff', 'tcgplayer': 'https://mtgjson.com/links/cca7760087ef9d0f'}",mythic,,d3346674-43cf-4006-b829-bf824560f413,b8ec7bd5-3635-4795-84ad-d6ac3edb5b67,775c41fa-2316-43c9-af34-ac9c9b0db7e2,oval,IKO,,,"Elemental,Dinosaur,Cat",Legendary,,212014,"Mutate {1}{W/U}{R}{R} (If you cast this spell for its mutate cost, put it over or under target non-Human creature you own. They mutate into the creature on top plus all abilities from under it.)
Flying, first strike
Whenever this creature mutates, you may cast target noncreature card with mana value 3 or less from your graveyard without paying its mana cost.",3,Legendary Creature — Elemental Dinosaur Cat,Creature,fe1607a2-4ffe-566c-a75f-dcbb6fa17b38,"f07d63b4-4708-56d6-930d-abae98a2d071,517e63e2-22dd-5747-9d10-608850ce3c30",
60847,60848,Riot Games,,,paper,,black,,255427,255426,,,R,,R,4.0,,1335.0,,,,,"nonfoil,foil",Round Two,"""I wish I could say it gets easier, kiddo, but I'd be lying.""
—Vander",,2015,,0,0,1,1,0,0,0,0,0,0,0,1,0,0,0,0,0,Flashback,English,normal,,,,{3}{R},4.0,,,,66d82872-7c76-5e1e-9cfe-c2fee98bda0c,,,,Seize the Day,480,,2021-11-29,,,,,"ODY,PHED,SLD,UMA",,"{'cardKingdom': 'https://mtgjson.com/links/7410de0e8c11cdfe', 'cardKingdomFoil': 'https://mtgjson.com/links/9d61838e03192c71', 'tcgplayer': 'https://mtgjson.com/links/28928a0fe78594c6'}",rare,,20006931-eaef-4a86-8082-cf487156ef71,4250ff03-c64f-4dcf-a4fa-e8baa6799373,2a6abd59-e448-46f1-9af8-bb9040645971,triangle,SLD,,,,,,259287,"Untap target creature. After this main phase, there is an additional combat phase followed by an additional main phase.
Flashback {2}{R} (You may cast this card from your graveyard for its flashback cost. Then exile it.)",,Sorcery,Sorcery,1ecdcf0d-0a2f-5cf6-b4fc-08ca628814d4,,
69489,69490,Dan Scott,,,"arena,mtgo,paper",,borderless,,253243,252659,,82746,U,,U,3.0,,2837.0,,,,,"nonfoil,foil",Search the Count's Castle,"I knew he had left the castle now, and thought to use the opportunity to explore more than I had dared to do as yet.",,2015,,0,0,1,1,0,0,0,0,0,0,0,0,0,1,0,0,0,,English,normal,,,,{2}{U},3.0,582695,346737,79134,f671f441-166d-5424-86cd-f586ce732a29,,,544468,Thirst for Discovery,333,,,Draw three cards. Then discard two cards unless you discard a basic land card.,Instant,,,"DBL,VOW","draculaseries,boosterfun","{'cardKingdom': 'https://mtgjson.com/links/613da79a76690763', 'cardKingdomFoil': 'https://mtgjson.com/links/624d644b487c84b2', 'cardmarket': 'https://mtgjson.com/links/2a26cc3bdb81cc56', 'tcgplayer': 'https://mtgjson.com/links/3c28392a394a7199'}",uncommon,,b1ed095e-6b77-4262-a2fa-d04dde96f9e4,698a535d-102f-492b-90bd-d4d50fc82520,1e05e6ef-14af-451d-9d54-e75b1f8871ab,,VOW,,,,,,253519,Draw three cards. Then discard two cards unless you discard a basic land card.,,Instant,Instant,54a94fc6-7197-5f1f-8fec-62e11d441c49,1a7c0af7-5017-5e54-8fb3-3a51b67eda15,
60812,60813,Kevin Gnutzmans,,,paper,,borderless,,,,,,W,,W,4.0,,287.0,,,,,"nonfoil,foil",Shrinking Storm,Watch the skies.,,2015,,0,0,1,1,0,0,0,0,0,0,0,1,0,0,0,0,0,,English,normal,,,,{2}{W}{W},4.0,,,,743fb1d0-4ed5-540f-9941-e797cf849af7,,,,Wrath of God,441,,2022-07-07,,,,,"10E,2ED,2XM,30A,3ED,4BB,4ED,5ED,6ED,7ED,8ED,9ED,AKR,BRB,C13,CED,CEI,EMA,FBB,LEA,LEB,MP2,P07,PLIST,POR,PRM,PTC,PZ1,SLD,SUM,V14,WC00,WC03,WC04",,{'tcgplayer': 'https://mtgjson.com/links/2a1d0600e1bfe67d'},rare,,0adf3831-93d9-4995-b8c8-0d8c03fee872,3690d35f-9222-4f82-8196-04534f16bb88,34515b16-c9a4-4f98-8c77-416a7a523407,triangle,SLD,,,,,,279355,Destroy all creatures. They can't be regenerated.,,Sorcery,Sorcery,980d6920-aba8-54a9-9176-08a99b12009c,4472fc52-ef97-5691-9a96-348c28a0c8cc,
69503,69504,Bastien L. Deharme,,,"arena,mtgo,paper",,borderless,,253166,252416,,82719,"B,R",,"B,R",6.0,,2882.0,,,,,"nonfoil,foil",Sisters of the Undead,,legendary,2015,,0,0,1,1,0,0,0,0,0,0,0,0,0,1,0,0,0,"Flying,Haste",English,normal,"{'brawl': True, 'commander': True, 'oathbreaker': False}",,,{4}{B}{R},6.0,581330,346583,79148,6261b287-da8a-5f92-85c2-f199b2039dd4,,,544482,"Olivia, Crimson Bride",343,,,"Flying, haste
Whenever Olivia, Crimson Bride attacks, return target creature card from your graveyard to the battlefield tapped and attacking. It gains ""When you don't control a legendary Vampire, exile this creature.""",Legendary Creature — Vampire Noble,,3,"DBL,PVOW,VOW","draculaseries,boosterfun","{'cardKingdom': 'https://mtgjson.com/links/fe88254389405dc3', 'cardKingdomFoil': 'https://mtgjson.com/links/77afc363c1c95eda', 'cardmarket': 'https://mtgjson.com/links/3fc5e3ba417ff104', 'tcgplayer': 'https://mtgjson.com/links/2a8766f9c5e8bf60'}",mythic,,0d5552d3-6860-42e5-8a13-1d36dce77322,8548c399-11a7-4a45-b55e-8b9d2ad40f17,8922a91e-3d15-4351-8d77-e0d6bc4de82e,oval,VOW,,,"Vampire,Noble",Legendary,,253204,"Flying, haste
Whenever Olivia, Crimson Bride attacks, return target creature card from your graveyard to the battlefield tapped and attacking. It gains ""When you don't control a legendary Vampire, exile this creature.""",4,Legendary Creature — Vampire Noble,Creature,d9d355f6-a4b8-5189-9d2a-6a074bf216cc,"91153fb8-a021-5b44-b41b-4362b9af9290,aa33985d-3379-50ec-b905-116aaeaa91f3",
