29128,29129,Zezhou Chen,,,"arena,mtgo,paper",,borderless,,,,,,B,,B,8.0,,4707.0,,,,,"nonfoil,foil","Spacegodzilla, Death Corona",,,2015,,0,0,1,1,0,0,0,0,0,0,0,0,0,1,0,0,0,"Cycling,Deathtouch",English,normal,,,,{6}{B}{B},8.0,451063,300408,73519,c8bfc442-9bce-566c-9707-292fb4169e4d,,,,Void Beckoner,373,,,,,,8,"IKO,PRM","boxtopper,godzillaseries,boosterfun","{'cardmarket': 'https://mtgjson.com/links/d72dc8f4d95a53f5', 'tcgplayer': 'https://mtgjson.com/links/b8f503139532c980'}",uncommon,,1ca7065e-88c1-44bb-ac68-e6e1df9e0726,7325f854-e119-439d-9c00-9eb76c502c44,7185e345-d8a1-4dd3-a071-f90f265634b4,,IKO,,,"Nightmare,Horror",,,212022,"Deathtouch
Cycling {2}{B} ({2}{B}, Discard this card: Draw a card.)
When you cycle Void Beckoner, put a deathtouch counter on target creature you control.",8,Creature — Nightmare Horror,Creature,5b62d7ac-440b-58f9-8086-a002d074cfd0,"e2fb0a41-862d-5872-b87b-26ce48a48964,15c513ba-f3be-56b0-b991-bbde1ecf5b01",
29129,29130,Zezhou Chen,,,"arena,mtgo,paper",,borderless,,233144,232176,,67254,B,,B,8.0,,4707.0,,,,,"nonfoil,foil","Spacegodzilla, Void Invader",,,2015,,0,0,1,1,0,0,0,0,0,0,0,0,0,1,0,0,0,"Cycling,Deathtouch",English,normal,,,,{6}{B}{B},8.0,451063,300408,,977d943c-8388-512b-9712-29fa7824713d,,,,Void Beckoner,373A,,,,,,8,"IKO,PRM","godzillaseries,boosterfun","{'cardKingdom': 'https://mtgjson.com/links/e0ac615fc646b2b4', 'cardKingdomFoil': 'https://mtgjson.com/links/9535e60a2244dec9', 'cardmarket': 'https://mtgjson.com/links/715a7894536da002', 'tcgplayer': 'https://mtgjson.com/links/7a82fdeda71d3ada'}",uncommon,,29ae88c2-1f9b-4515-9f2e-78e1dc5468b1,7325f854-e119-439d-9c00-9eb76c502c44,7185e345-d8a1-4dd3-a071-f90f265634b4,,IKO,,,"Nightmare,Horror",,,212022,"Deathtouch
Cycling {2}{B} ({2}{B}, Discard this card: Draw a card.)
When you cycle Void Beckoner, put a deathtouch counter on target creature you control.",8,Creature — Nightmare Horror,Creature,15c513ba-f3be-56b0-b991-bbde1ecf5b01,"e2fb0a41-862d-5872-b87b-26ce48a48964,5b62d7ac-440b-58f9-8086-a002d074cfd0",
61010,61011,Riot Games,,,paper,,black,,262229,260714,,,,,,0.0,,2.0,,,,,"nonfoil,foil",Summoner's Rift,"There is a place apart from this world, a rift where pretense falls away and champions find their glory.",,2015,,0,0,1,1,0,0,0,0,0,0,0,1,0,0,0,0,0,,English,normal,,,,,0.0,,,,6da9c6fa-8ac5-5c9e-9a3e-94a717ee402c,,,,Command Tower,697,,2021-11-29,,,,,"40K,AFC,ANB,BRC,C13,C15,C16,C17,C18,C19,C20,C21,CC1,CC2,CLB,CM1,CM2,CMA,CMD,CMR,DMC,ELD,J12,KHC,MIC,NCC,NEC,PHED,PRM,PZ1,SLD,VOC,ZNC",,"{'cardKingdom': 'https://mtgjson.com/links/47dc2b4dce54560e', 'cardKingdomFoil': 'https://mtgjson.com/links/624a7c66ae225421', 'tcgplayer': 'https://mtgjson.com/links/0ff9e9dab4fcb466'}",rare,,0e863861-eb0d-4f86-9770-bd32b8227d07,660c8dea-1c6b-4272-8fa2-38581dfa8bab,0895c9b7-ae7d-4bb3-af17-3b75deb50a25,triangle,SLD,,,,,,257777,{T}: Add one mana of any color in your commander's color identity.,,Land,Land,a45a4e2c-1437-51dd-837a-5e62520c3e2d,b15e263f-6952-5472-9a60-1a4e006e9c2e,
60814,60815,Rudy Siswanto,,,paper,,borderless,,,,,,U,,U,2.0,,590.0,,,,,"nonfoil,foil",Supply Llama,"Don't worry, they want you to smash them.",inverted,2015,,0,0,1,1,0,0,0,0,0,0,0,1,0,0,0,0,0,,English,normal,,,,{1}{U},2.0,,,,ce46be73-225f-57f8-80e3-37cf5fc52dbf,,,,Etherium Sculptor,443,,2022-07-07,,,,1,"ALA,C16,C18,DDU,MMA,NEC,PS11,SLD",,{'tcgplayer': 'https://mtgjson.com/links/58ecd9728d8e8fca'},rare,,e7f9bbf2-aa52-4daf-937e-29aef8810d35,423282f0-7d16-4a8c-91c4-de8aff0f0499,96b87445-6362-4a17-91b2-cbf203fd03fd,triangle,SLD,,,"Vedalken,Artificer",,,279356,Artifact spells you cast cost {1} less to cast.,2,Artifact Creature — Vedalken Artificer,"Artifact,Creature",3c0841f8-d88f-5db1-9930-c49994fad202,,
60818,60819,Alexandre Leoni,,,paper,,borderless,,,,,,,,,6.0,,2613.0,,,,,"nonfoil,foil",The Cube,Its power levels are off the charts.,"legendary,inverted",2015,,0,0,1,1,0,0,0,0,0,0,0,1,0,0,0,0,0,,English,normal,,,,{6},6.0,,,,b34d7773-7f5e-592b-8609-24281d9dc4ae,,,,Planar Bridge,447,,2022-07-07,,,,,"2X2,AER,KLR,MPS,PAER,SLD",,{'tcgplayer': 'https://mtgjson.com/links/bcba195cabfda021'},mythic,,593cbbd0-6ec3-4506-be0c-a229f070ce6d,effca9d4-ded2-49ae-8cae-982cb7ed1edf,853c6cc0-ed2b-4d65-add1-2449ade8cf68,triangle,SLD,,,,Legendary,,279353,"{8}, {T}: Search your library for a permanent card, put it onto the battlefield, then shuffle.",,Legendary Artifact,Artifact,1c1ce283-686e-5ad0-9302-d985b02173f7,,
60850,60851,Riot Games,,,paper,,black,,254866,254865,,,,,,4.0,,207.0,,,,,"nonfoil,foil",The Hexcore,The power of the Arcane too often finds itself in the hands of those foolish enough to think themselves its master.,,2015,,0,0,1,1,0,0,0,0,0,0,0,1,0,0,0,0,0,,English,normal,,,,{4},4.0,,,,5f70dd9d-48b4-5227-b669-19e7811f75f3,,,,Thran Dynamo,483,,2021-11-29,,,,,"ARC,C14,C19,IMA,MB1,PZ1,SLD,UDS,V13,WC00,WC99",,"{'cardKingdom': 'https://mtgjson.com/links/eabfc530b299ee86', 'cardKingdomFoil': 'https://mtgjson.com/links/7db48b85c24f51dd', 'tcgplayer': 'https://mtgjson.com/links/ba3cab8822263a85'}",rare,,186a57f5-5806-4373-90a6-0da950a11054,ab3deee3-3935-4c3e-8c65-f08cd734a482,a699c663-8131-4045-9265-a83e86609374,triangle,SLD,,,,,,259275,{T}: Add {C}{C}{C}.,,Artifact,Artifact,89a6f0a2-4fd6-539c-9f85-f0fcb4b70513,,
60998,60999,Kevin Gnutzmans,,,paper,,black,,,,,,,,,0.0,,2.0,,,,,"nonfoil,foil",The Spire,What did you do to the Zero Point?,inverted,2015,,0,0,1,1,0,0,0,0,0,0,0,1,0,0,0,0,0,,English,normal,,,,,0.0,676510,,,e5b8b4fe-65c8-5894-bb83-0be2cadb8ef2,,,,Command Tower,677,,2022-07-07,,,,,"40K,AFC,ANB,BRC,C13,C15,C16,C17,C18,C19,C20,C21,CC1,CC2,CLB,CM1,CM2,CMA,CMD,CMR,DMC,ELD,J12,KHC,MIC,NCC,NEC,PHED,PRM,PZ1,SLD,VOC,ZNC",,{'tcgplayer': 'https://mtgjson.com/links/601be0b472e30849'},rare,,5e97d936-c3dc-42ae-a028-4a183d13ccc8,8a2a199b-48e1-4af7-940a-10d6928d273b,0895c9b7-ae7d-4bb3-af17-3b75deb50a25,triangle,SLD,,,,,,282701,{T}: Add one mana of any color in your commander's color identity.,,Land,Land,b15e263f-6952-5472-9a60-1a4e006e9c2e,a45a4e2c-1437-51dd-837a-5e62520c3e2d,
69491,69492,Nils Hamm,,,"arena,mtgo,paper",,borderless,,253231,252597,,82739,B,,B,4.0,,4335.0,4.0,The Three Weird Sisters,4.0,Henrika Domnathi,"nonfoil,foil",The Three Weird Sisters // Fiends of Darkest Night,,"legendary,sunmoondfc",2015,,0,0,1,1,0,0,0,0,0,0,0,0,0,1,0,0,0,"Flying,Transform",English,transform,"{'brawl': True, 'commander': True, 'oathbreaker': False}",,,{2}{B}{B},4.0,582246,346761,79136,4b9de89f-c23f-52ff-990f-6f0342d58336,,,544470,"Henrika Domnathi // Henrika, Infernal Seer",335,,,"Flying
At the beginning of combat on your turn, choose one that hasn't been chosen —
• Each player sacrifices a creature.
• You draw a card and you lose 1 life.
• Transform Henrika Domnathi.",Legendary Creature — Vampire,357a2aaa-7be5-511a-b03e-1918d184b113,1,"DBL,PVOW,VOW","draculaseries,boosterfun","{'cardKingdom': 'https://mtgjson.com/links/1008fbab26a0a909', 'cardKingdomFoil': 'https://mtgjson.com/links/c706f984bb4831fb', 'cardmarket': 'https://mtgjson.com/links/04cfd32350859a92', 'tcgplayer': 'https://mtgjson.com/links/11a3a54caf340513'}",mythic,,aafe47a8-0223-4c0b-b6ce-e25446a07c96,7ea5f6c8-7bf9-4a90-97c8-34aa0db567c9,0c0845c3-f4b5-444e-8f42-da0c7dbf2841,oval,VOW,a,,Vampire,Legendary,,253439,"Flying
At the beginning of combat on your turn, choose one that hasn't been chosen —
• Each player sacrifices a creature.
• You draw a card and you lose 1 life.
• Transform Henrika Domnathi.",3,Legendary Creature — Vampire,Creature,d0a03e2c-3f7f-5a87-91c7-64c19784be7a,"ba2ee893-217a-510d-bbcb-bf08ea32ad5c,d8b431d0-7574-5fd5-bb26-cdd7aaa6614c",
69492,69493,Nils Hamm,,,"arena,mtgo,paper",,borderless,,,,,82739,B,B,B,4.0,,4335.0,0.0,Fiends of Darkest Night,0.0,"Henrika, Infernal Seer","nonfoil,foil",The Three Weird Sisters // Fiends of Darkest Night,"Nothing can be more dreadful than those awful women, who were—who are—waiting to suck my blood.","legendary,sunmoondfc",2015,,0,0,1,1,0,0,0,0,0,0,0,0,0,1,0,0,0,"Deathtouch,Flying,Lifelink",English,transform,,,,,4.0,582246,,79136,116df4e4-7ce5-5d2b-80f7-e540c5e3d530,,,544471,"Henrika Domnathi // Henrika, Infernal Seer",335,,,"Flying, deathtouch, lifelink
{1}{B}{B}: Each creature you control with flying, deathtouch, and/or lifelink gets +1/+0 until end of turn.",Legendary Creature — Vampire,d0a03e2c-3f7f-5a87-91c7-64c19784be7a,3,"DBL,PVOW,VOW","draculaseries,boosterfun",{'tcgplayer': 'https://mtgjson.com/links/6b2e27b30e2c8499'},mythic,,aafe47a8-0223-4c0b-b6ce-e25446a07c96,cde48b4e-13a5-4c2d-af2c-9973513ffd5d,0c0845c3-f4b5-444e-8f42-da0c7dbf2841,oval,VOW,b,,Vampire,Legendary,,253439,"Flying, deathtouch, lifelink
{1}{B}{B}: Each creature you control with flying, deathtouch, and/or lifelink gets +1/+0 until end of turn.",4,Legendary Creature — Vampire,Creature,357a2aaa-7be5-511a-b03e-1918d184b113,"a0ee90ad-676b-523c-9a6c-871b4713eece,4300fc34-0c2c-52d4-9852-a66ad482c948",
60845,60846,Riot Games,,,paper,,black,,254862,254861,,,U,,U,3.0,,32.0,,,,,"nonfoil,foil",Unstable Harmonics,"""I believe I've discovered something truly incredible: a way to harness magic through science!""
—Jayce Talis",,2015,,0,0,1,1,0,0,0,0,0,0,0,1,0,0,0,0,0,,English,normal,,,,{2}{U},3.0,,,,30988721-d1bd-5b99-9f94-ead0ca2e8b75,,,,Rhystic Study,478,,2021-11-29,,,,,"CM1,J18,JMP,MB1,PCY,PRM,PZ1,SLD,TD0",,"{'cardKingdom': 'https://mtgjson.com/links/c6b632203840eb1d', 'cardKingdomFoil': 'https://mtgjson.com/links/9892f25f567d71da', 'tcgplayer': 'https://mtgjson.com/links/cf7ad3bbea87f96c'}",rare,,c9a85474-e0e5-40cf-b0a3-a2b7da7f7000,f8020bce-826b-4ac2-a571-6466b5a856ce,53236dd7-845a-444c-96d5-f41ed7325d8f,triangle,SLD,,,,,,259290,"Whenever an opponent casts a spell, you may draw a card unless that player pays {1}.",,Enchantment,Enchantment,1df90f3c-8ca1-5ffd-ba84-43e73ec44660,,
69484,69485,Dan Scott,,,"arena,mtgo,paper",,borderless,,253246,252668,,82743,W,,W,2.0,,17525.0,,,,,"nonfoil,foil",Van Helsing's Holy Ward,,,2015,,0,0,1,1,0,0,0,0,0,0,0,0,0,1,0,0,0,,English,normal,,,,{1}{W},2.0,583234,346967,79129,cb0580c7-61ee-5105-acb0-620d6f89d331,,,544463,Circle of Confinement,329,,,"When Circle of Confinement enters the battlefield, exile target creature an opponent controls with mana value 3 or less until Circle of Confinement leaves the battlefield.
Whenever an opponent casts a Vampire spell with the same name as a card exiled with Circle of Confinement, you gain 2 life.",Enchantment,,,"DBL,VOW","draculaseries,boosterfun","{'cardKingdom': 'https://mtgjson.com/links/8600ddbb922d5376', 'cardKingdomFoil': 'https://mtgjson.com/links/453a95cc30d90b31', 'cardmarket': 'https://mtgjson.com/links/684388ecb11176b6', 'tcgplayer': 'https://mtgjson.com/links/9d430d4927b87ee4'}",uncommon,,f0cb7bbb-9216-43b7-abd8-387f6c7864e6,4b14e39d-10ae-4e2f-850a-b6baab42ccbc,d1cd7a93-4b83-4755-90bc-17cb64bfb131,,VOW,,,,,,253549,"When Circle of Confinement enters the battlefield, exile target creature an opponent controls with mana value 3 or less until Circle of Confinement leaves the battlefield.
Whenever an opponent casts a Vampire spell with the same name as a card exiled with Circle of Confinement, you gain 2 life.",,Enchantment,Enchantment,b90a5274-07f5-5268-9435-ffdb5e36dee4,61d350d7-95fc-5445-a82e-219097f6fc1d,
60716,60717,Pauline Voss,,,paper,,black,,252212,252207,,,"B,W",,"B,W",2.0,,8815.0,,,,,"nonfoil,foil",Will the Wise,,legendary,2015,,0,0,1,1,0,0,0,0,0,0,0,0,0,0,0,0,0,Investigate,English,normal,"{'brawl': False, 'commander': True, 'oathbreaker': False}",,,{W}{B},2.0,,,,6922f849-878c-5791-b0e0-376a5e7758e0,,,,"Wernog, Rider's Chaplain",347,,2021-10-15,,,,1,"SLD,SLX",,"{'cardKingdom': 'https://mtgjson.com/links/66d4266182db9dbf', 'cardKingdomFoil': 'https://mtgjson.com/links/0cc5f556a60b2989', 'tcgplayer': 'https://mtgjson.com/links/3b3bdde69b818e4f'}",rare,,25a4af68-6e5e-4b44-9c1c-25ecdbd555b5,40534e95-f1cd-43c3-b7f2-917b84752d18,6cd03270-54cc-43e1-9b86-70c76960c841,triangle,SLD,,,Human,Legendary,,251746,"When Wernog, Rider's Chaplain enters or leaves the battlefield, each opponent may investigate. Each opponent who doesn't loses 1 life. You investigate X times, where X is one plus the number of opponents who investigated this way.
Friends forever (You can have two commanders if both have friends forever.)",2,Legendary Creature — Human,Creature,361e3a5d-681f-5d5a-bfcd-8b4ef6eb52c7,,
